article_url,title,doi,publication_date,author,abstract,archive_url,import_date
https://firstmonday.org/ojs/index.php/fm/article/view/640,First Monday Interviews: James O'Donnell and Gregory Crane,https://doi.org/10.5210/fm.v4i1.640,1999-01-04,Alex Soojung-Kim Pang, None available.,https://firstmonday.org/ojs/index.php/fm/issue/view/100,2025-01-21 14:23:58
https://firstmonday.org/ojs/index.php/fm/article/view/639,Beyond portals and gifts: Towards a bottom-up net-economy,https://doi.org/10.5210/fm.v4i1.639,1999-01-04,Felix Stalder," The Internet is haunted by its own promise: the liberation of information. Typically, this promise is a strange hybrid of 60's progressive libertarianism and 90's aggressive venture capitalism. The slogan ""information wants to be free"" still shapes the dynamics of on-line content consumption and production. The results: America Online and Netscape merge and the high-tech gift economy flourishes.",https://firstmonday.org/ojs/index.php/fm/issue/view/100,2025-01-21 14:23:55
https://firstmonday.org/ojs/index.php/fm/article/view/638,Consumer power via the Internet,https://doi.org/10.5210/fm.v4i1.638,1999-01-04,Trond Andresen," Recently, there has been plenty of upbeat reporting on new opportunities provided by the Internet to business in marketing and sales and in financial services, to name a few. Most of these developments may be said to increase ""firm-power"". This paper describes a proposal to strongly enhance ""consumer-power"" to the ultimate benefit of both businesses and consumers..",https://firstmonday.org/ojs/index.php/fm/issue/view/100,2025-01-21 14:23:53
https://firstmonday.org/ojs/index.php/fm/article/view/637,The Internet cultural phenomenon: A bonafide curricular theme,https://doi.org/10.5210/fm.v4i1.637,1999-01-04,Toufic Hakim," Beyond the use of its resources as a research tool, the Internet presents a rich cultural theme for interdisciplinary coursework. In 1996-97, two interdisciplinary courses about and on the Internet were offered at Jacksonville University by four professors from different departments. This paper focuses on the structure, content, and value of, as well as lessons learned from, these virtual courses. Entitled Issues on the Internet, the courses were designed to immerse traditional students in the virtual culture for one semester while exploring issues in science and technology, political science, business and sociology.",https://firstmonday.org/ojs/index.php/fm/issue/view/100,2025-01-21 14:23:50
https://firstmonday.org/ojs/index.php/fm/article/view/636,Internet in America's Schools: Potential catalysts for policy makers,https://doi.org/10.5210/fm.v4i1.636,1999-01-04,Joseph Slowinski," As societies move toward the new millennium, Internet initiatives are being introduced in schools throughout the world. Yet, not without controversy. For example, in the United States fears of access to Internet pornography has dampened the potential enthusiasm for the further introduction of the Internet in schools. Furthermore, a recent study by Carnegie Mellon University found that increased exposure to the Internet led to increased levels of depression and isolation. With these fears circulating, it is inherently more problematic to urge policy makers and parents to desire technology in the classroom. In this article, in an effort to introduce potential points of dialog entry for policy makers, I examine three views that advocate the further implementation of Internet in schools: human capital, democracy and empowerment.",https://firstmonday.org/ojs/index.php/fm/issue/view/100,2025-01-21 14:23:47
https://firstmonday.org/ojs/index.php/fm/article/view/651,First Monday interviews: Jonathan Peizer,https://doi.org/10.5210/fm.v4i2.651,1999-02-01,Geert Lovink, None available.,https://firstmonday.org/ojs/index.php/fm/issue/view/102,2025-01-21 14:24:12
https://firstmonday.org/ojs/index.php/fm/article/view/650,Non-profit organisations and the Internet,https://doi.org/10.5210/fm.v4i2.650,1999-02-01,Martin Johnson," The Internet is the fastest growing communications medium in the world. While some individuals and companies have been quick to capitalise on this medium, non-profit organisations have been slower on the uptake. However with a decline in the level of donations from traditional donors who are aging and a shift by their children away from their parent's spirit of philanthropy, the Internet may offer non-profits a way of reaching new donors.	Worldwide, Internet users have above-average incomes, good jobs and are aged between 21 and 45 years of age. It is this age group that non-profit organisations identify as being the donors of the future. Traditional means of fund-raising appear not to be as effective in soliciting donations from this group. Non-profit organisations worldwide are also looking to the Internet as another way of communicating with their donors.	This paper looks at how non-profits worldwide are using the Internet and then by means of an online survey, seeks to determine what issues Internet users identify as being of concern when asked about making online donations.	Visitors to a non-profit Internet site were asked to identify the issue or issues that would be of concern if asked to make an online donation with 'credit card security' and 'privacy of provided information' as two key issues. Provided these concerns are answered, the survey found that 65 percent of visitors to the site would be willing to make a donation online. In addition, those aged between 19 and 45 and who had used the Internet for between two and three years were more likely to make a donation.	The survey also found that concerns about 'where the money goes' and the efficiency of the organisation, identified by respondents were similar to concerns expressed by donors to non-profits through traditional means.",https://firstmonday.org/ojs/index.php/fm/issue/view/102,2025-01-21 14:24:09
https://firstmonday.org/ojs/index.php/fm/article/view/649,"Flexible networking, information and communications technology and local economic development",https://doi.org/10.5210/fm.v4i2.649,1999-02-01,Michael Gurstein, This paper examines the impact of information technologies on rural communities and suggests new efforts to support local economies with globally connected networks.,https://firstmonday.org/ojs/index.php/fm/issue/view/102,2025-01-21 14:24:07
https://firstmonday.org/ojs/index.php/fm/article/view/648,"Education and community: The Collective Wisdom of Teachers, Parents and Community Members",https://doi.org/10.5210/fm.v4i2.648,1999-02-01,Ted Nellen," Education seems to have become everyone's business. Everyone has a stake in education yet everyone doesn't have access to the educational process. Most frustrating has been the lack of real interaction between schools and their communities. Those schools that succeed all have a common thread: community involvement. Connecting all schools to their local communities in a viable way has been physically impossible. It is the contention of this paper that real connections between communities and schools can be made by the Internet. The Internet not only connects scholars in the schools to outside resources, but it also allows the community to observe the performance of its local scholars as telementors. Telementoring ultimately connects communities to their schools and creates more effective learning environments for all.",https://firstmonday.org/ojs/index.php/fm/issue/view/102,2025-01-21 14:24:04
https://firstmonday.org/ojs/index.php/fm/article/view/647,Technology and pleasure: Considering hacking constructive,https://doi.org/10.5210/fm.v4i2.647,1999-02-01,Gisle Hannemyr," Hackersare identified as a specific subgroup of computer workers. The history of the hacker community is told. The explicit and implicit ideologies expressed through hacking is analyzed and presented. Computer artifacts of origin both inside and outside the hacker community are compared and the embedded properties of the resulting artifacts are inferred. Hacking is discussed in the context of being a method for system development. Finally, it is argued that this system development method under certain circumstances may yield superior software artifacts.",https://firstmonday.org/ojs/index.php/fm/issue/view/102,2025-01-21 14:24:01
https://firstmonday.org/ojs/index.php/fm/article/view/652,FM Reviews,https://doi.org/10.5210/fm.v4i2.652,1999-02-01,Lucinda Covert-Vail, None available.,https://firstmonday.org/ojs/index.php/fm/issue/view/102,2025-01-21 14:24:15
https://firstmonday.org/ojs/index.php/fm/article/view/655,Consumers as subcontractors on electronic markets,https://doi.org/10.5210/fm.v4i3.655,1999-03-01,Wilfred Dolfsma," With the Internet, the relation between the consumer and retailers will change dramatically. Customization will mean that retail businesses in electronic markets will need information about the preferences of consumers to alter products competitively. Consumers, in turn, will invest time and energy in establishing relations with certain retailers; retailers will collect and process consumer-derived information easily and cheaply using information technology. The economic literature on transaction costs suggests that, as a result, consumers may become locked into certain relationships with retailers. Consumers may ultimately become dependent subcontractors to retailers.",https://firstmonday.org/ojs/index.php/fm/issue/view/103,2025-01-21 14:24:22
https://firstmonday.org/ojs/index.php/fm/article/view/656,Technology and education: Between chaos and order,https://doi.org/10.5210/fm.v4i3.656,1999-03-01,Mohammad Khalid Hamza," More than any period in recorded history, today's heterogeneity of emergent technology has transformed daily life, particularly the lives of the many fascinated by it. The American educational system and its sense of direction have not been spared from the chaos and distress that accompanies this unprecedented era. Many educators await the promise of technology's power to improve the educational system. The purpose of this paper is not to validate the pros or cons of technology, but to explore current issues facing the American educational system and to better use technologies in a productive and a creative manner. This article explores contemporary issues of technology in education, investigating its impact upon the American educational system, and examining the nature of its unprecedented relationship to the posthaste changes of the information age. This article also suggests systematic procedures that may be used to assess the needs of an institution's educational information system (EIS), and the dimension of building creative educational climate to better meet instructional goals and to sustain the continual needs of a quality educational system.",https://firstmonday.org/ojs/index.php/fm/issue/view/103,2025-01-21 14:24:25
https://firstmonday.org/ojs/index.php/fm/article/view/653,Policy and participation on the Canadian information highway,https://doi.org/10.5210/fm.v4i3.653,1999-03-01,William F. Birdsall," The debate over universal access is focused on too narrow a concept by all sides of the argument. Furthermore, this debate continues to be an exclusive one dominated by special interest groups operating in a legalistic regulatory process. As an alternative, this paper proposes that the issue of universal access be addressed in the broader conceptual framework of the right to communicate. As well, the policy debate should be moved to the political arena through an initiative to incorporate the right to communicate in the Canadian Charter of Rights and Freedoms.",https://firstmonday.org/ojs/index.php/fm/issue/view/103,2025-01-21 14:24:17
https://firstmonday.org/ojs/index.php/fm/article/view/654,DNS: A short history and a short future,https://doi.org/10.5210/fm.v4i3.654,1999-03-01,Ted Byfield," This paper examines some of the basic premises that typify the rhetoric of the DNS debates. It challenges the assumption that these problems are new; instead, they reiterate the text-to-number mapping problems that plagued the national and international integration of telephony systems. The later telephonic transitions were marked by an interplay between the phasing-out of telephonic addressing systems and marketing innovations. DNS is faced with an analogous problem: DNS policies inflexibly founded on past conditions have conspired with marketing forces to create an illusory scarcity of domain names. The easy correspondence between domain names and names used in other spheres of life, a correspondence that business interests demand, is untenable; and reforms geared toward facilitating such a situation are undesirable. Newer techniques that offer even higher levels of abstraction than DNS are paving the way practical solutions: domain names will cease to be a primary interface for navigation, and in ways that will facilitate the exploitation of the entire name space.",https://firstmonday.org/ojs/index.php/fm/issue/view/103,2025-01-21 14:24:20
https://firstmonday.org/ojs/index.php/fm/article/view/657,Letters to the Editor,https://doi.org/10.5210/fm.v4i3.657,1999-03-01,Katherine Phelps, None available.,https://firstmonday.org/ojs/index.php/fm/issue/view/103,2025-01-21 14:24:28
https://firstmonday.org/ojs/index.php/fm/article/view/660,The Semiotics of SimCity,https://doi.org/10.5210/fm.v4i4.660,1999-04-05,Ted Friedman," When does a game cease to be a game? Is it when the computer feels like an organic extension of your consciousness or when you may feel like an extension of the computer itself? This paper explores SimCity and its significance as a simulator not only of reality but consciousness. Computer gaming is essentially process of demystification, discovering how software is organized for a certain set of goals and actions.",https://firstmonday.org/ojs/index.php/fm/issue/view/104,2025-01-21 14:24:36
https://firstmonday.org/ojs/index.php/fm/article/view/662,Letters to the Editor,https://doi.org/10.5210/fm.v4i4.662,1999-04-05,Clint Brooks, None available.,https://firstmonday.org/ojs/index.php/fm/issue/view/104,2025-01-21 14:24:41
https://firstmonday.org/ojs/index.php/fm/article/view/659,"Electronic purses, interoperability and the Internet",https://doi.org/10.5210/fm.v4i4.659,1999-04-05,Leo VanHove," These last few months the move toward the standardization of electronic purses has gained considerable momentum. Card issuers and newspapers present this move as crucial for crossborder transactions, and especially urgent for the Euro-zone. Starting from the network externalities theory, I argue that interoperability is more important for electronic commerce over the Internet than for real-world cross-border transactions.",https://firstmonday.org/ojs/index.php/fm/issue/view/104,2025-01-21 14:24:33
https://firstmonday.org/ojs/index.php/fm/article/view/658,Arguments for Recalling WIPO RFC3,https://doi.org/10.5210/fm.v4i4.658,1999-04-05,Ed Gerck," The Internet Domain Name System (DNS) allows a user to associate a name with a resource on the Internet, such as a machine, an electronic mail address, or a Web site. Trademarks exist in another, more traditional, name system which permits a customer to associate a product name with an enterprise, the mark owner. This paper argues that DNS names are intersubjective and never objective, while trademarks are objective and may also be intersubjective. These basic differences between a DNS name and a trademark name were however fully ignored by the World Intellectual Property Organization (WIPO) report RFC3, which seeks to regulate worldwide Internet domain names in purely objective terms. This paper further demonstrates that conflicts between the two naming systems exist in the intersubjective arena but are less than 0.04% for a typical well-known mark in a period of nine months. These results suggest that WIPO's RFC3 is basically flawed in motivation, qualification, and method, so that it should be recalled in totum. Its application would more probably cause more difficulties to Internet users and trademark owners than the few confusing cases it may avoid. A solution to these problems may be found in digital identity certification or at least origin authentication. ""Business server certificates"" - based on cryptographic challenge-response - can concretely define an objective business identifier on the Internet and can be used to support trademark requirements. Other issues such as cybersquatting, anonymity in DNS registration and tracing and stopping trademark-infringement sites are also treated in this paper.",https://firstmonday.org/ojs/index.php/fm/issue/view/104,2025-01-21 14:24:31
https://firstmonday.org/ojs/index.php/fm/article/view/661,"Scholarly publishing, peer review and the Internet",https://doi.org/10.5210/fm.v4i4.661,1999-04-05,Peter Roberts," The Internet is arguably one of the most significant technological developments of the late 20th century. From its modest beginnings some decades ago - where the use of networked computers was largely limited to to a select group of technical specialists in research institutions, the military and government - to the present situation, with a complex global grid of more than 50 million users, the Internet has become an increasingly important medium of communication in a variety of public and private spheres. In the international academic community the arrival of the Internet has received a mixed reception, with responses ranging from unbridled enthusiasm to outright hostility. My preferred stance is one of cautious optimism. This paper addresses one domain of academic activity where I believe such a stance might be appropriate, namely, scholarly publishing. A number of different forms of writing in cyberspace are identified, and some of the arguments in favour of moving from print-based publishing to electronic environments are assessed. The paper reinforces the need for rigorous systems of peer review in scholarly work, and considers possible futures for serials in cyberspace.",https://firstmonday.org/ojs/index.php/fm/issue/view/104,2025-01-21 14:24:39
https://firstmonday.org/ojs/index.php/fm/article/view/672,Information Ecologies: Using Technology with Heart - Chapter Four: Information Ecologies,https://doi.org/10.5210/fm.v4i5.672,1999-05-03,Bonnie Nardi, None available,https://firstmonday.org/ojs/index.php/fm/issue/view/106,2025-01-21 14:24:54
https://firstmonday.org/ojs/index.php/fm/article/view/669,Information Ecologies: Using Technology with Heart - Preface,https://doi.org/10.5210/fm.v4i5.669,1999-05-03,Bonnie Nardi," The common rhetoric about technology falls into two extreme categories: uncritical acceptance or blanket rejection. These two positions leave us with poor choices for action. They encourage us to accept as inevitable whatever technological changes come along. Claiming a middle ground, these chapters from the book Information Ecologies (Cambridge, Mass.: MIT Press, 1999) call for responsible, informed engagement with technology in local settings, or information ecologies. An information ecology is a system of people, practices, technologies, and values in a local environment. Like their biological counterparts, information ecologies are diverse, continually evolving, and complex.",https://firstmonday.org/ojs/index.php/fm/issue/view/106,2025-01-21 14:24:46
https://firstmonday.org/ojs/index.php/fm/article/view/670,Information Ecologies: Using Technology with Heart - Chapter One: Rotwang the Inventor,https://doi.org/10.5210/fm.v4i5.670,1999-05-03,Bonnie Nardi, None Available,https://firstmonday.org/ojs/index.php/fm/issue/view/106,2025-01-21 14:24:49
https://firstmonday.org/ojs/index.php/fm/article/view/668,Information Ecologies: Using Technology with Heart - Table of Contents,https://doi.org/10.5210/fm.v4i5.668,1999-05-03,Bonnie Nardi," The common rhetoric about technology falls into two extreme categories: uncritical acceptance or blanket rejection. These two positions leave us with poor choices for action. They encourage us to accept as inevitable whatever technological changes come along. Claiming a middle ground, these chapters from the book Information Ecologies (Cambridge, Mass.: MIT Press, 1999) call for responsible, informed engagement with technology in local settings, or information ecologies. An information ecology is a system of people, practices, technologies, and values in a local environment. Like their biological counterparts, information ecologies are diverse, continually evolving, and complex.",https://firstmonday.org/ojs/index.php/fm/issue/view/106,2025-01-21 14:24:44
https://firstmonday.org/ojs/index.php/fm/article/view/671,Information Ecologies: Using Technology with Heart - Chapter Two: Framing Conversations about Technology,https://doi.org/10.5210/fm.v4i5.671,1999-05-03,Bonnie Nardi, None available,https://firstmonday.org/ojs/index.php/fm/issue/view/106,2025-01-21 14:24:52
https://firstmonday.org/ojs/index.php/fm/article/view/676,The growth of internet telephony: Legal and policy issues,https://doi.org/10.5210/fm.v4i6.676,1999-06-07,Emir A. Mohammed," The growth of Internet Telephony as a potential challenge to regular telephony or the Plain-Old Telephone System (POTS) is an area of academic inquiry long overlooked. This paper critically examines the opposition to Internet telephony with particular emphasis on the 1996 America's Carriers Telecommunication Association (ACTA) petition to the U.S. Federal Communications Commission (FCC), in addition to the European Commission's attitudes towards the matter. The semantic difficulties attached to an understanding of defining what exactly ""Internet Telephony"" means are also addressed.",https://firstmonday.org/ojs/index.php/fm/issue/view/107,2025-01-21 14:25:06
https://firstmonday.org/ojs/index.php/fm/article/view/675,"Intelligent agents, markets and competition: Consumers' interests and functionality of destination sites",https://doi.org/10.5210/fm.v4i6.675,1999-06-07,Kees Jonkheer," Intelligent agents are first and foremost tools which can be applied in numerous and different ways. However, Intelligent agents, in the true sense of attributed functions such as autonomy and pro-activity, do not yet exist. There are agent-like applications like Web crawlers and search engines which sometimes include collaborative filtering; in spite of these advances a software entity that combines all of these functions into an intelligent agent has yet to be developed. Still, it is only a matter of time when intelligent agents will play a decisive role in the electronic marketplace and therefore in competition. This paper explores the boundaries of what might happen in markets when intelligent agents are introduced and used by market participants. It discusses existing commercial agent-like applications and treats models on how different functions of agents could affect different market stages. Two types of markets - travel and bookselling - are examined, focusing on consumers' interests and the functionality of destination sites.",https://firstmonday.org/ojs/index.php/fm/issue/view/107,2025-01-21 14:25:03
https://firstmonday.org/ojs/index.php/fm/article/view/674,"Declarations, independence, and text in the information age",https://doi.org/10.5210/fm.v4i6.674,1999-06-07,Richard J. Cox," The World Wide Web has presented new opportunities for the creation and dissemination of documents, especially in providing a greater power to citizens to proclaim opinions and to call for actions. There have been, of course, such documents before the Web. The Declaration of Independence was made all the more powerful, for example, because of the power of print to multiply copies and to support public readings of it as the American colonies took up arms against England. Renewed interest in the preservation of the original manuscript of the Declaration provides an opportunity to compare how, in the emerging Knowledge Age, we should consider documents and their text as well as to question what records professionals such as archivists should see as their priorities. Can we, from this time on, conceive of textual preservation in the same manner? Can we even have the same sense of primary or sacred documents as we have in the past? At the least, can we exhibit or use older documents in the same fashion as we did prior to the advent of the Web?",https://firstmonday.org/ojs/index.php/fm/issue/view/107,2025-01-21 14:25:00
https://firstmonday.org/ojs/index.php/fm/article/view/673,The street performer protocol and digital copyrights,https://doi.org/10.5210/fm.v4i6.673,1999-06-07,John Kelsey," We introduce the Street Performer Protocol, an electronic-commerce mechanism to facilitate the private financing of public works. Using this protocol, people would place donations in escrow, to be released to an author in the event that the promised work be put in the public domain. This protocol has the potential to fund alternative or ""marginal"" works.",https://firstmonday.org/ojs/index.php/fm/issue/view/107,2025-01-21 14:24:58
https://firstmonday.org/ojs/index.php/fm/article/view/678,First Monday Letters.,https://doi.org/10.5210/fm.v4i6.678,1999-06-07,Claire Jones, None available.,https://firstmonday.org/ojs/index.php/fm/issue/view/107,2025-01-21 14:25:11
