article_url,title,doi,publication_date,author,abstract,archive_url,import_date
https://firstmonday.org/ojs/index.php/fm/article/view/838,Extending the public sphere through cyberspace: The case of Minnesota E-Democracy,https://doi.org/10.5210/fm.v6i3.838,2001-03-05,Lincoln Dahlberg," Over the last decade a lot has been said about the possibilities of the Internet enhancing the public sphere. The two-way, decentralized communications within cyberspace are seen as offering the basis by which to facilitate rational-critical discourse and hence develop public opinion that can hold state power accountable. However, this potential has largely gone unrealized. Instead, cyber-interaction is dominated by commercial activity, private conversation, and individualized forms of politics. In this paper I investigate how the present Internet may be used to more fully facilitate the public sphere. To do this I evaluate Minnesota E-Democracy, an Internet-based initiative that attempts to develop online public discourse. Drawing upon a model of the public sphere developed from Jrgen Habermas' work, I show how the initiative structures discourse to overcome many of the problems that presently limit democratic deliberation online. While some significant limitations do remain, I conclude that Minnesota E-Democracy provides a basis from which online deliberative initiatives can, given adequate resourcing and further research, extend the public sphere through the Internet.",https://firstmonday.org/ojs/index.php/fm/issue/view/131,2025-01-21 14:31:43
https://firstmonday.org/ojs/index.php/fm/article/view/843,Book Reviews,https://doi.org/10.5210/fm.v6i3.843,2001-03-05,Wendy Clark, None available.,https://firstmonday.org/ojs/index.php/fm/issue/view/131,2025-01-21 14:31:56
https://firstmonday.org/ojs/index.php/fm/article/view/842,A response to Mr. Henderson,https://doi.org/10.5210/fm.v6i3.842,2001-03-05,Richard J. Cox, None Available,https://firstmonday.org/ojs/index.php/fm/issue/view/131,2025-01-21 14:31:53
https://firstmonday.org/ojs/index.php/fm/article/view/837,Playing the links: Interactivity and stickiness in .com and not.com Web sites,https://doi.org/10.5210/fm.v6i3.837,2001-03-05,Debora Shaw," Creators of commercial (.com) and non-commercial (not.com) Web sites presumably have different goals, which may be revealed in the number and nature of links from the sites. This study examines links from the home pages of heavily used Web sites, finding that commercial sites have more links. Not.com sites vary considerably in linking behavior, with .gov and .org sites having the most links. Commercial sites have a lower percentage of links to outside sites, possibly an indication of design for stickiness to keep visitors on site while .net sites show the highest rate of external linking.",https://firstmonday.org/ojs/index.php/fm/issue/view/131,2025-01-21 14:31:40
https://firstmonday.org/ojs/index.php/fm/article/view/851,A shared digital library of Native American images,https://doi.org/10.5210/fm.v6i4.851,2001-04-02,Elaine Peterson," Montana State University has available on the Web a digital library called the ""Indian Peoples of the Northern Great Plains."" The key elements of this collaborative IMLS project were the sharing of equipment, staff, and images.",https://firstmonday.org/ojs/index.php/fm/issue/view/132,2025-01-21 14:32:21
https://firstmonday.org/ojs/index.php/fm/article/view/846,"Growing a National Learning Environments and Resources Network for Science, Mathematics, Engineering, and Technology Education",https://doi.org/10.5210/fm.v6i4.846,2001-04-02,Lee L. Zia, None Available.,https://firstmonday.org/ojs/index.php/fm/issue/view/132,2025-01-21 14:32:05
https://firstmonday.org/ojs/index.php/fm/article/view/850,Teacher's palette,https://doi.org/10.5210/fm.v6i4.850,2001-04-02,Diana Helton Rennels, None Available.,https://firstmonday.org/ojs/index.php/fm/issue/view/132,2025-01-21 14:32:18
https://firstmonday.org/ojs/index.php/fm/article/view/849,Piloting a course: Using a pilot project to identify training needs,https://doi.org/10.5210/fm.v6i4.849,2001-04-02,Allison Zhang," Connecticut History Online, a collaboration of The Connecticut Historical Society, The Thomas J. Dodd Research Center at The University of Connecticut and Mystic Seaport, has recently completed a pilot project that is helping to define and shape future training for students and teachers. An initial panel of Teacher Advisors helped create the original program for Connecticut History Online. Further input was obtained through meetings with Teacher Advisors, e-mail responses, and statistics regarding the use of the site. This input is being used to plan training workshops and online tutorials to expose teachers to potential uses of primary research material in the classroom and to encourage them to create their own lesson plans. Ongoing feedback from teachers will assure that Connecticut History Online continues to meet their needs in training students to build observation, analysis and critical thinking skills while preparing for the Connecticut Mastery Test and the Connecticut Academic Performance Test.",https://firstmonday.org/ojs/index.php/fm/issue/view/132,2025-01-21 14:32:14
https://firstmonday.org/ojs/index.php/fm/article/view/848,Toward context-centered methods for evaluating public library networked community information initiatives,https://doi.org/10.5210/fm.v6i4.848,2001-04-02,Joan C. Durrance," The Internet provides new ways for citizens to access information about the community, which has often been difficult to obtain in the past. To gain a better understanding of how public libraries and their partner organizations are poised to provide such community information (CI) in the next decade we have conducted a major study of the provision of CI and its use. Funded by the Institute of Museum and Library Services (IMLS) ""Help-Seeking in an Electronic World: The Impact of Electronic Access to Community Information on Citizens' Information Behavior and Public Libraries"" (www.si.umich.edu/helpseek) is a multi-stage research project consisting of a two-stage national survey of the provision of CI in the digital age and case studies of public library community networking partnerships, which were designed to provide in-depth knowledge of community networking approaches. We identified a wide range of impacts of digital CI services and systems on citizens, organizations, and communities. The examples we discuss are indicative of the ways that CI librarians and those who are building community networks contribute to the social fabric of their communities. In this article we present 1) an introduction to public library involvement in CI provision; 2) examples of digital best practices and community networking activities; 3) a discussion of benefits of networked CI and community networks from the perspective of users; and, 4) implications for evaluation since current tools cannot determine the impact of digital CI initiatives.",https://firstmonday.org/ojs/index.php/fm/issue/view/132,2025-01-21 14:32:10
https://firstmonday.org/ojs/index.php/fm/article/view/847,Afya: Social and digital technologies that reach across the digital divide,https://doi.org/10.5210/fm.v6i4.847,2001-04-02,Ann Peterson Bishop," This paper presents initiatives taken in the Afya project towards bridging the digital divide through social and digital literacy, equitable access, training, and content initiatives at the community level. As a participatory action research project, Afya (Swahili for ""health"") is designed to engage African American women in assessing and increasing their access to quality health information and services. Based on principles of social justice, the project is geared towards redefining relationships and achieving constructive social change at a community-wide level.",https://firstmonday.org/ojs/index.php/fm/issue/view/132,2025-01-21 14:32:08
https://firstmonday.org/ojs/index.php/fm/article/view/845,Mobile library literacy: Solutions for a rural environment,https://doi.org/10.5210/fm.v6i4.845,2001-04-02,Sybil Brigham McShane," Funded by the Institute of Museum and Library Services (IMLS), the State of Vermont Department of Libraries is beginning a two-year ""Mobile Library Literacy"" project to discover if mobile library services are a viable means for serving rural and suburban populations in the 21st century. In announcing the grant, Vermont's U.S. Senator James Jeffords described the project as designed ""to promote access to books, reading programs, and information through technology. [It] will extend the walls of the library ... and welcome all Vermonters to be part of the learning community.""",https://firstmonday.org/ojs/index.php/fm/issue/view/132,2025-01-21 14:32:02
https://firstmonday.org/ojs/index.php/fm/article/view/844,They threw me a computer but what I really needed was a life preserver,https://doi.org/10.5210/fm.v6i4.844,2001-04-02,Anthony G. Wilhelm," Libraries and museums have a central role to play in ensuring that all Americans are able to access and use effectively emerging communications tools, such as the Internet. These institutions are key pillars of the public sphere of communications, the realm of civil society independent of government and commercial forces that provides citizens the tools to become full participants in republican self-government. This paper identifies four attributes of the digital divide -- literacy, access, content and training -- and discusses the role of libraries and museums in cultivating each of these capacities. The central thrust of the paper is that there are comprehensive solutions to bridge the divide (in the realization of these four elements) where the technological component is necessary but not sufficient to move the truly disadvantaged into the mainstream of American life.",https://firstmonday.org/ojs/index.php/fm/issue/view/132,2025-01-21 14:31:59
https://firstmonday.org/ojs/index.php/fm/article/view/853,"Boyle Heights: Neighborhood sites and insights, a multicultural community partnership initiative of the Japanese American National Museum",https://doi.org/10.5210/fm.v6i4.853,2001-04-02,Audrey Lee-Sung, None Available,https://firstmonday.org/ojs/index.php/fm/issue/view/132,2025-01-21 14:32:26
https://firstmonday.org/ojs/index.php/fm/article/view/852,"Bridging the digital divide: State government as content provider, the Illinois experience",https://doi.org/10.5210/fm.v6i4.852,2001-04-02,Anne Craig," Three National Leadership Grants (NLG) (http://www.imls.gov/grants/library/lib_nlgl.asp) from the Institute for Museum and Library Services (IMLS) provide the foundation for the Find-It! Illinois Program (http://finditillinois.org) at the Illinois State Library (ISL):	Grant One: ""Exporting Washington State's GILS"" (October 1998-September 1999)	Grant Two: ""Find-It! Illinois"" (October 1999-September 2001)	Grant Three: ""Metadata Tools for State Collaboration"" (October 1999-September 2001)	Based on the successful Government Information Locator Service (GILS) program at the Washington State Library (WSL) (http://find-it.state.wa.us/compass), the ISL began a GILS program of its own in the fall of 1999. State-level GILS projects around the country, based at state libraries and some state archives, are distilled from the federal GILS model (http://www.gils.net/). State GILS programs provide a resource discovery methodology for electronic state government information. Each program includes components for access, organization, design, standard metadata creation, state agency Webmaster education and training, and interface development. Essentially, the state libraries and archives involved in these projects act as clearinghouses for and gateways to electronic state government information.	Grant One, awarded to the WSL, provided the ISL and three other state libraries, (Oregon, New Hampshire, and Arizona), with the model framework for starting a GILS program. Grant Two, awarded to the ISL, provided development dollars for the fledgling ISL program Find-It! Illinois. Grant Three, awarded to the WSL and contracted in part to the ISL, provides funding for the enhancement of metadata interoperability and the application of a consortial subject tree.	In Illinois, providing access to electronic state government content is manifest not only in the establishment of the ISL GILS program, but also in the creation of the other databases that comprise the Find-It! Illinois portal. Interoperability among these Find-It! virtual libraries will be enhanced by the application of a single controlled vocabulary for subject searching, called the ""Jessica Tree."" Additionally, work is underway to establish the Jessica Tree as the standard list for state GILS programs with the goal of promoting interstate interoperable subject searching.",https://firstmonday.org/ojs/index.php/fm/issue/view/132,2025-01-21 14:32:23
https://firstmonday.org/ojs/index.php/fm/article/view/859,Transaction costs and the social cost of online privacy,https://doi.org/10.5210/fm.v6i5.859,2001-05-07,Paul Sholtz," Economically, privacy can be understood as a problem of social cost, where the actions of one agent (e.g., a mailing list broker) impart a negative externality on another agent (e.g., an end consumer). Problems in social cost can be understood by modeling the liabilities, transaction costs and property rights assigned to various economic agents within the system, and can be resolved by reallocating property rights and liability to different agents as needed to achieve economic equilibrium. This article examines how advances in high speed networking and data storage have radically reduced the costs to businesses of collecting, storing, manipulating and exchanging large amounts of personally identifying information on consumers, and the policy implications that these cost reductions have on property rights over personal information. A complementary economic and legal system that recognizes individual property rights over personal information is suggested as a way in which to greatly accelerate the adoption of electronic commerce and to extract inefficiencies from the already existing marketplace for personal information.",https://firstmonday.org/ojs/index.php/fm/issue/view/133,2025-01-21 14:32:42
https://firstmonday.org/ojs/index.php/fm/article/view/863,Book reviews,https://doi.org/10.5210/fm.v6i5.863,2001-05-07,Glenn Dalgarno, None available.,https://firstmonday.org/ojs/index.php/fm/issue/view/133,2025-01-21 14:32:52
https://firstmonday.org/ojs/index.php/fm/article/view/862,Of Jeff Bezos and Leo Durocher,https://doi.org/10.5210/fm.v6i5.862,2001-05-07,Richard Wiggins, None Available.,https://firstmonday.org/ojs/index.php/fm/issue/view/133,2025-01-21 14:32:50
https://firstmonday.org/ojs/index.php/fm/article/view/861,Letter from Nebraska: Wiring the world,https://doi.org/10.5210/fm.v6i5.861,2001-05-07,Steve Cisler, None Available,https://firstmonday.org/ojs/index.php/fm/issue/view/133,2025-01-21 14:32:47
https://firstmonday.org/ojs/index.php/fm/article/view/860,Policy bridges for the digital divide: Assessing the landscape and gauging the dimensions,https://doi.org/10.5210/fm.v6i5.860,2001-05-07,Paul M.A. Baker," Early evidence of economic and social change related to the diffusion of a number of information and communication technologies (ICTs) suggests that public sector actors face significant opportunities, as well as some unexpected barriers while ""paving the information highway"". These technologies have generated significant changes in the nature, and operation of communication and delivery of services by the private sector increasing the impetus to accelerate adoption of these technologies in the public sector. While the advantages of accessing these services is well accepted, the benefits of the use of these technologies has been observed to occur in a distressingly uneven or patchy manner. This variation, which for the sake of simplicity has been described by extending the information superhighway metaphor as ""gaps"" or ""divides"" in the development of the ""highway"". This paper suggests that a disservice is done in reducing the apparent inequities in the diffusion of the technologies to a simple socioeconomic concern. Rather than a one-dimensional ""digital divide,"" more accurately there is a policy problem related to the use and deployments of ICTs with multiple geographic, social, economic and organizational components.	Further, ICTs present policymakers with an array of complex issues that extend beyond purely internal technological concerns. Rather than answering the question of how should public sector functions respond to the changes made possible by diffusion of ICTs, a more critical step seems to be to accurately gauge the nature of the issue rather than jump in and lay ""digital pavement"". This paper explores ramifications of the deployment of these technologies and suggests dimensions of the problem that merit further assessment.",https://firstmonday.org/ojs/index.php/fm/issue/view/133,2025-01-21 14:32:45
https://firstmonday.org/ojs/index.php/fm/article/view/858,The work of education in the age of E-College,https://doi.org/10.5210/fm.v6i5.858,2001-05-07,Chris Werry," There has recently been a mad rush by universities, venture capitalists and corporations to develop online courses, virtual universities, education portals, and courseware. The drive to develop a winning formula for commercial online education has fostered some unusual partnerships. This paper provides a broad overview of some models of online education that have been developed by commercial and academic institutions. It examines some of the rhetorical strategies that have been used to talk about online education by commercial groups, and discusses some of the hopes and fears that have been associated with online instruction by academics, administrators, and businesspeople. The paper outlines some of the main players and positions involved in debates about online education, and suggests some strategies that academic groups ought to explore. In particular, the author argues that academics need something an open source movement for academic resources, akin to the Free Software Foundation. This 'Free Courseware Foundation' would give teachers greater control of their resources, and better enable them to share materials with other teachers and with the public.",https://firstmonday.org/ojs/index.php/fm/issue/view/133,2025-01-21 14:32:39
https://firstmonday.org/ojs/index.php/fm/article/view/857,"Managing complex, distributed environments: Remote meeting technologies at the Chaotic Fringe",https://doi.org/10.5210/fm.v6i5.857,2001-05-07,Karen Ruhleder," This paper is based on an ethnographic study of a company with widely distributed holdings within a volatile industry. The need for this distributed organization to respond as a unified whole to a rapidly changing environment required it to confront the uncertainties and contingencies introduced by invisibility, distance, and fragmentation of information. In order to transcend the boundaries of time and space, the company coupled new technologies with new ways of organizing work. Groupware and remote meeting technologies provided a common virtual workscape. In this paper, we focus on issues generated by the integration of remote meeting technologies into local work practices. We compare face-to-face meetings with virtual meetings to understand how these new technologies impact the work of a distributed organization, and to uncover the new order that emerges around the use of these technologies.",https://firstmonday.org/ojs/index.php/fm/issue/view/133,2025-01-21 14:32:37
https://firstmonday.org/ojs/index.php/fm/article/view/856,Understanding online message dissemination: An analysis of Send-this-story-to-your-friend data,https://doi.org/10.5210/fm.v6i5.856,2001-05-07,Sandeep Krishnamurthy," Our goal in this paper was to analyze ""send-this-story-to-a-friend"" data. Encouraging consumers to send stories to friends is an application of viral marketing which envisions message dissemination through customer-to-customer communication rather than firm-to-customer communication. It makes sense for a publisher to include this feature since individuals are more likely to accept the recommendations of their friends and this may increase theit probability of reading the story by making it more salient. We collected publicly available data from ESPN.com over an 11-day period. Using this data, our findings are: first, the number of times stories are sent out represent a miniscule proportion of visits to the site; second, if the top story is very influential, it may increase the total visits to the site and there may be spillover effect; third, there is an interesting weekend effect with a drop in the number of stories sent out; and, finally we observe an interesting floor effect when we analyze the ratio of the top and bottom stories.",https://firstmonday.org/ojs/index.php/fm/issue/view/133,2025-01-21 14:32:34
https://firstmonday.org/ojs/index.php/fm/article/view/855,The impact of the Internet on Myanmar,https://doi.org/10.5210/fm.v6i5.855,2001-05-07,Viola Krebs," In the present paper, I explore how the Internet has affected the flow of information between in and outside Myanmar (Burma). I show that there is a strong difference between the way information was presented before and after the introduction of the World Wide Web.	Within the last century, the country has been marked by political instability (Eliot, 1997; Freedom House, 2000). Particularly since its separation from British colonial rule in 1948, Burma has witnessed significant political change, violence and unrest. Since the early 1960s, Burma has essentially been an isolated state, with closed borders and a military government. However, the fall of the Berlin wall and the end of the Cold War seem to suggest that isolationism is growing less common worldwide. Importantly, meteoric advances in communications have also paralleled the fall of isolationism.	In my study, I examine two political events in Myanmar connected to student uprisings, in the hope of documenting how the Internet - as an easily researched symbol of modern communications - may be affecting the political strategies of one of the last isolated states.",https://firstmonday.org/ojs/index.php/fm/issue/view/133,2025-01-21 14:32:32
https://firstmonday.org/ojs/index.php/fm/article/view/854,Circulating libraries and video rental stores,https://doi.org/10.5210/fm.v6i5.854,2001-05-07,Richard Roehl," We describe a number of interesting parallels between circulating libraries in England circa 1725-1850 and video rental stores in the United States circa 1980-1990. Both institutions evolved in a similar manner, which suggests that common economic and social forces were at work. Perhaps the histories of these two industries may be helpful in understanding current and future developments in computer- and Internet-related media.",https://firstmonday.org/ojs/index.php/fm/issue/view/133,2025-01-21 14:32:29
https://firstmonday.org/ojs/index.php/fm/article/view/867,Internet teaching and the administration of knowledge,https://doi.org/10.5210/fm.v6i6.867,2001-06-04,Tara Brabazon, None Available.,https://firstmonday.org/ojs/index.php/fm/issue/view/134,2025-01-21 14:33:03
https://firstmonday.org/ojs/index.php/fm/article/view/864,The battle to define the future of the book in the digital world,https://doi.org/10.5210/fm.v6i6.864,2001-06-04,Clifford Lynch," Commercial publishing interests are presenting the future of the book in the digital world through the promotion of e-book reading appliances and software. Implicit in this is a very complex and problematic agenda that re-establishes the book as a digital cultural artifact within a context of intellectual property rights management enforced by hardware and software systems. With the convergence of different types of content into a common digital bit-stream, developments in industries such as music are establishing precedents that may define our view of digital books. At the same time we find scholars exploring the ways in which the digital medium can enhance the traditional communication functions of the printed work, moving far beyond literal translations of the pages of printed books into the digital world. This paper examines competing visions for the future of the book in the digital environment, with particular attention to questions about the social implications of controls over intellectual property, such as continuity of cultural memory.",https://firstmonday.org/ojs/index.php/fm/issue/view/134,2025-01-21 14:32:55
https://firstmonday.org/ojs/index.php/fm/article/view/865,The Wall Street performer protocol: Using software completion bonds to fund open source software development,https://doi.org/10.5210/fm.v6i6.865,2001-06-04,Chris Rasch," In their article ""The Street Performer Protocol and Digital Copyrights"" (Kelsey and Schneier, 1999) suggest that copyright will become increasingly difficult to enforce. They propose a general mechanism for funding digital public works, the ""Street Performer Protocol"" in which authors produce their work only after they receive enough contributions to make it worth their while. In this article, I sketch out a proposal for the creation of a software completion bond market. I think such a market would be a practical implementation of the ""Street Performer Protocol"" for the funding of open source software. I first describe how such a bond market might work, and why I think the open source community needs a bond market. Then I examine the underlying economics of open source software. Finally, I review some of the existing and potential alternatives to a software completion bond market. [1].",https://firstmonday.org/ojs/index.php/fm/issue/view/134,2025-01-21 14:32:58
